month,date,year,title,description,imageurl,moreinfourl
JANUARY,1,2012,Galaxy Leo IV,"Leo IV is one of more than a dozen ultra-faint dwarf galaxies near the Milky Way. These galaxies are dominated by dark matter, an invisible substance that makes up most of the universe's mass.",https://imagine.gsfc.nasa.gov/hst_bday/images/january-1-2019-galaxy-leo-iv.jpg,https://hubblesite.org/contents/media/images/2012/26/3054-Image.html
JANUARY,2,2005,Galaxy Cluster SDSS J1004+4112,"This picture captures a galaxy cluster called SDSS J1004+4112 that's so massive that its gravity bends light from galaxies behind it. The light of a distant quasar (the brilliant core of an active galaxy) has been bent around the cluster, appearing in five places in this image.",https://imagine.gsfc.nasa.gov/hst_bday/images/january-2-2019-galaxy-cluster-sdss-j1004-4112.jpg,https://hubblesite.org/contents/media/images/2006/23/1929-Image.html
JANUARY,3,2017,NGC 4302 and NGC 4298,"This image captures two spiral galaxies. They look quite different because we see them from different angles. The edge-on galaxy (on the left) is called NGC 4302, and the other is NGC 4298.",https://imagine.gsfc.nasa.gov/hst_bday/images/january-3-2019-ngc-4302-and-ngc-4298.png,https://hubblesite.org/contents/media/images/2017/14/4019-Image.html
JANUARY,4,1998,Saturn in Infrared,"This false-color image of Saturn captures infrared light reflecting off the planet. The image also captures two of Saturn's moons, Dione in the lower left and Tethys in the upper right.",https://imagine.gsfc.nasa.gov/hst_bday/images/january-4-2019-saturn-in-infrared.jpg,https://hubblesite.org/contents/media/images/1998/18/659-Image.html
JANUARY,5,2010,Galaxy NGC 2841,"Young, blue stars and dark lanes of dust trace the winding arms of NGC 2841. Winds from the young stars may have cleared out the gas needed for additional star birth and halted star formation in the spiral galaxy.",https://imagine.gsfc.nasa.gov/hst_bday/images/january-5-2019-galaxy-ngc-2841.jpg,https://hubblesite.org/contents/media/images/2011/06/2821-Image.html
JANUARY,6,2006,Interacting Galaxies Arp 220,"Arp 220 is the result of a collision between two spiral galaxies that began 700 millions years ago. Located about 250 million light-years from Earth, it is one of the nearest galaxy mergers to our planet.",https://imagine.gsfc.nasa.gov/hst_bday/images/january-6-2019-interacting-galaxies-arp-220.jpg,https://hubblesite.org/contents/media/images/2008/16/2314-Image.html
JANUARY,7,2010,Galaxy NGC 2841,"Young, blue stars and dark lanes of dust trace the winding arms of NGC 2841. Winds from the young, super-hot stars may have cleared out the gas needed for additional star birth and halted star formation in the spiral galaxy.",https://imagine.gsfc.nasa.gov/hst_bday/images/january-7-2019-galaxy-ngc-2841.jpg,https://hubblesite.org/contents/media/images/2011/06/2821-Image.html
JANUARY,8,2007,Galaxy NGC 2976,"This picture shows the inner region of NGC 2976, located roughly 11 million light-years away in the constellation Ursa Major. Despite the lack of well-defined arms visible in this image, NGC 2976 is a spiral galaxy.",https://imagine.gsfc.nasa.gov/hst_bday/images/january-8-2019-galaxy-ngc-2976.jpg,https://hubblesite.org/contents/media/images/2010/05/2682-Image.html
JANUARY,9,2003,Galaxy NGC 1427A,"This image captures NGC 1427A, an irregular dwarf galaxy that is warped by the gravitational influence of its larger galactic neighbors in the Fornax galaxy cluster.",https://imagine.gsfc.nasa.gov/hst_bday/images/january-9-2019-galaxy-ngc-1427a.jpg,https://hubblesite.org/contents/media/images/2005/09/1662-Image.html
JANUARY,10,1998,Galaxy Centaurus A,"This image captures a turbulent firestorm of star birth along a nearly edge-on dust disk girdling nearby galaxy Centaurus A. Brilliant clusters of young, blue stars lie along the edge of the dark dust lane.",https://imagine.gsfc.nasa.gov/hst_bday/images/january-10-2019-galaxy-centaurus-a.jpg,https://hubblesite.org/contents/media/images/1998/14/637-Image.html
JANUARY,11,2000,Eskimo Nebula,"The Eskimo Nebula contains the glowing remains of a dying Sun-like star. The bright, central region of the Eskimo's ""face"" is material being blown away by the nebula's central star.",https://imagine.gsfc.nasa.gov/hst_bday/images/january-11-2019-eskimo-nebula.jpg,https://hubblesite.org/contents/media/images/2000/07/940-Image.html
JANUARY,12,2011,Andromeda Galaxy,"Over 100 million stars are on display in this portion of the Andromeda galaxy, located over 2 million light-years away. This portrait of our galactic neighbor is the largest image yet assembled by Hubble.",https://imagine.gsfc.nasa.gov/hst_bday/images/january-12-2019-andromeda-galaxy.jpg,https://hubblesite.org/contents/news-releases/2015/news-2015-02.html
JANUARY,13,2011,Andromeda Galaxy,"Over 100 million stars are on display in this portion of the Andromeda galaxy, located over 2 million light-years away. This portrait of our galactic neighbor is the largest image yet assembled by Hubble.",https://imagine.gsfc.nasa.gov/hst_bday/images/january-13-2019-andromeda-galaxy.jpg,https://hubblesite.org/contents/news-releases/2015/news-2015-02.html
JANUARY,14,2003,Galaxy NGC 2768,"NGC 2768 is an elliptical galaxy located 65 million light-years away in the constellation Ursa Major. The galaxy hosts a supermassive black hole, fueling jets of material in its active center.",https://imagine.gsfc.nasa.gov/hst_bday/images/january-14-2019-galaxy-ngc-2768.jpg,https://hubblesite.org/contents/news-releases/2015/news-2015-28.html
JANUARY,15,2006,Galaxy NGC 4710,"The magnificent galaxy NGC 4710 is tilted nearly edge-on to our view from Earth. This perspective allows the central bulge of stars to be easily distinguished from the galaxy's pancake-flat disk of stars, dust and gas.",https://imagine.gsfc.nasa.gov/hst_bday/images/january-15-2019-galaxy-ngc-4710.jpg,https://hubblesite.org/contents/media/images/2009/30/2643-Image.html
JANUARY,16,2004,Lindsay-Shapley Ring Galaxy,"The striking blue ring of the Lindsay-Shapely Ring Galaxy (AM 0644-741) is comprised of brilliant star clusters. About 150,000 light-years across, the ring structure is larger than our galaxy, the Milky Way.",https://imagine.gsfc.nasa.gov/hst_bday/images/january-16-2019-lindsay-shapley-ring-galaxy.jpg,https://hubblesite.org/contents/media/images/2004/15/1520-Image.html
JANUARY,17,2017,Supernova 1987A,"The remnant of Supernova 1987A, located in a neighboring galaxy called the Large Magellanic Cloud, appears at the center of this image. The red, gaseous clouds that surround it fuel a firestorm of new star formation.",https://imagine.gsfc.nasa.gov/hst_bday/images/january-17-2019-supernova-1987a.png,https://hubblesite.org/contents/media/images/2017/08/3987-Image.html
JANUARY,18,2004,Galaxy NGC 4163,"This swarm of stars is the dwarf galaxy NGC 4163, located 10 million light-years from Earth in the constellation Canes Venatici. Irregularly shaped red blobs are regions of active star formation.",https://imagine.gsfc.nasa.gov/hst_bday/images/january-18-2019-galaxy-ngc-4163.jpg,https://hubblesite.org/contents/media/images/2009/19/2556-Image.html
JANUARY,19,2005,Whirlpool Galaxy,"This image provides a close-up of some of the winding arms in the Whirlpool galaxy. Tracing the arms of the spiral galaxy are red-colored clouds of hydrogen gas, which are giving birth to new stars.",https://imagine.gsfc.nasa.gov/hst_bday/images/january-19-2019-whirlpool-galaxy.jpg,https://hubblesite.org/contents/media/images/2005/21/1731-Image.html
JANUARY,20,2005,Whirlpool Galaxy,"This image provides a close-up of some of the winding arms in the Whirlpool galaxy. Tracing the arms of the spiral galaxy are red-colored clouds of hydrogen gas, which are giving birth to new stars.",https://imagine.gsfc.nasa.gov/hst_bday/images/january-20-2019-whirlpool-galaxy.jpg,https://hubblesite.org/contents/media/images/2005/21/1731-Image.html
JANUARY,21,2000,Reflection Nebula NGC 1999,NGC 1999 is a reflection nebula. It does not emit any visible light of its own but shines only because the light from the star just to the left of the center illuminates the nebula's dust.,https://imagine.gsfc.nasa.gov/hst_bday/images/january-21-2019-reflection-nebula-ngc-1999.jpg,https://hubblesite.org/contents/media/images/2000/10/952-Image.html
JANUARY,22,2005,Whirlpool Galaxy,"This image captures the winding arms of the Whirlpool galaxy. It highlights the galaxy's graceful, curving arms, pink star-forming regions and brilliant blue strands of star clusters.",https://imagine.gsfc.nasa.gov/hst_bday/images/january-22-2019-whirlpool-galaxy.jpg,https://hubblesite.org/contents/media/images/2011/03/2809-Image.html
JANUARY,23,2004,Asteroid Ceres,"The largerst known asteriod, Ceres, is approximately 590 miles across, about the size of Texas. It resides with tens of thousands of other asteroids in the main asteroid belt.",https://imagine.gsfc.nasa.gov/hst_bday/images/january-23-2019-asteroid-ceres.jpg,https://hubblesite.org/contents/media/images/2005/27/1763-Image.html
JANUARY,24,2015,Jupiter and Moons,"Three of Jupiter's moons cast their shadows on the planet. Callisto and Io are visible in the lower left and upper right, respectively, but Europa (whose shadow is on Jupiter's left edge) is out of the frame.",https://imagine.gsfc.nasa.gov/hst_bday/images/january-24-2019-jupiter-and-moons.jpg,https://hubblesite.org/contents/media/images/2015/05/3488-Image.html
JANUARY,25,2000,Galaxy NGC 4013,A dark band of dust bisects the spiral galaxy NGC 4013. This edge-on galaxy is located 55 million light-years away in the constellation Ursa Major.,https://imagine.gsfc.nasa.gov/hst_bday/images/january-25-2019-galaxy-ngc-4013.jpg,https://hubblesite.org/contents/media/images/2001/07/1022-Image.html
JANUARY,26,2016,Comet 332P/Ikeya-Murakami,This image reveals the ancient comet 332P/Ikeya-Murakami disintegrating as it approaches the Sun. It is one of the sharpest views ever captured of an icy comet breaking apart.,https://imagine.gsfc.nasa.gov/hst_bday/images/january-26-2019-comet-332p-ikeya-murakami.jpg,https://hubblesite.org/contents/media/images/2016/35/3785-Image.html
JANUARY,27,2016,Comet 332P/Ikeya-Murakami,This image reveals the ancient comet 332P/Ikeya-Murakami disintegrating as it approaches the Sun. It is one of the sharpest views ever captured of an icy comet breaking apart.,https://imagine.gsfc.nasa.gov/hst_bday/images/january-27-2019-comet-332p-ikeya-murakami.jpg,https://hubblesite.org/contents/media/images/2016/35/3784-Image.html
JANUARY,28,2016,Comet Ikeya-Murakami,This image reveals the ancient comet 332P/Ikeya-Murakami disintegrating as it approached the Sun in 2016. The comet debris consists of building-size chunks near the center of the image. The main nucleus of the comet is the bright object at lower left.,https://imagine.gsfc.nasa.gov/hst_bday/images/january-28-2019-comet-ikeya-murakami.jpg,https://hubblesite.org/contents/media/images/2016/35/3784-Image.html
JANUARY,29,1999,Galaxy NGC 2787,Galaxy NGC 2787 is located 24 million light-years from Earth in the constellation Ursa Major. Arms of dark dust encircle the galaxy's bright center. The points of light scattered around the galaxy are huge collections of old stars known as globuar clusters.,https://imagine.gsfc.nasa.gov/hst_bday/images/january-29-2019-galaxy-ngc-2787.jpg,https://hubblesite.org/contents/media/images/2002/07/1164-Image.html
JANUARY,30,2010,Galaxy NGC 5584,"The brilliant, blue glow of young stars traces the graceful spiral arms of galaxy NGC 5584. Thin, dark dust lanes appear to be flowing from the yellowish core, where older stars reside.",https://imagine.gsfc.nasa.gov/hst_bday/images/january-30-2019-galaxy-ngc-5584.jpg,https://hubblesite.org/contents/media/images/2011/08/2824-Image.html?news=true
JANUARY,31,1996,Starfield in the Large Magellanic Cloud,"Over 10,000 stars appear in this image, which covers a region about 130 light-years wide in a nearby galaxy called the Large Magellanic Cloud. The faintest stars in the picture are some 100 million times dimmer than the human eye can see.",https://imagine.gsfc.nasa.gov/hst_bday/images/january-31-2019-starfield-in-the-large-magellanic-cloud.jpg,https://hubblesite.org/contents/media/images/1999/44/922-Image.html
FEBRUARY,1,2010,Carina Nebula Pillars,These cosmic pinnacles lie within a tempestuous stellar nursery called the Carina Nebula. Infant stars buried inside the pillars fire off jets of gas that stream away from the towering peaks.,https://imagine.gsfc.nasa.gov/hst_bday/images/february-1-2019-carina-nebula-pillars.jpg,https://hubblesite.org/contents/media/images/2010/13/2707-Image.html
FEBRUARY,2,2010,Carina Nebula Pillars,These cosmic pinnacles lie within a tempestuous stellar nursery called the Carina Nebula. Infant stars buried inside the pillars fire off jets of gas that stream away from the towering peaks.,https://imagine.gsfc.nasa.gov/hst_bday/images/february-2-2019-carina-nebula-pillars.jpg,https://hubblesite.org/contents/media/images/2010/13/2707-Image.html
FEBRUARY,3,1995,Bow Shock Around LL Orionis,"Named for the crescent-shaped wave made by a ship as it moves through water, a bow shock can be created in space when streams of gas collide. This image captures the bow shock around the star LL Orionis.",https://imagine.gsfc.nasa.gov/hst_bday/images/february-3-2019-bow-shock-around-ll-orionis.jpg,https://hubblesite.org/contents/media/images/2002/05/1149-Image.html
FEBRUARY,4,2005,Galaxy Cluster MACS J0717.5+3745,Nearly every object in this image is a distant galaxy in the cluster MACS J0717.5+3745. Some faint arcs and streaks in the image are even farther galaxies whose light has been bent by the powerful gravity of the massive cluster.,https://imagine.gsfc.nasa.gov/hst_bday/images/february-4-2019-galaxy-cluster-macs-j0717-5-3745.jpg,https://hubblesite.org/contents/media/images/2013/44/3251-Image.html
FEBRUARY,5,2019,Asteroid (6478) Gault,"Hubble viewed the gradual self-destruction of the asteroid (6478) Gault caused by the long-term effects of sunlight. Dusty material ejected from the asteroid formed two comet-like tails 500,000 and 3,000 miles long.",https://imagine.gsfc.nasa.gov/hst_bday/images/february-5-2019-asteroid-6478-gault.png,https://hubblesite.org/contents/media/images/2019/22/4379-Image.html
FEBRUARY,6,2007,Planetary Nebula NGC 2440,"Planetary nebula NGC 2440 is a relic of a star once like our Sun that has cast off its outer layers of gas, forming a colorful cocoon around the star's remaining core.",https://imagine.gsfc.nasa.gov/hst_bday/images/february-6-2019-planetary-nebula-ngc-2440.jpg,https://hubblesite.org/contents/media/images/2007/09/2058-Image.html
FEBRUARY,7,1999,Thackeray's Globules,"These dense, dark dust clouds, named ""Thackeray's globules"" after astronomer A.D. Thackeray, are silhouetted against stars and bright gas clouds of the star-forming region IC 2944. The largest globule is actually two separate, overlapping clouds.",https://imagine.gsfc.nasa.gov/hst_bday/images/february-7-2019-thackeray-s-globules.jpg,https://hubblesite.org/contents/media/images/2002/01/1127-Image.html
FEBRUARY,8,2014,Monkey Head Nebula,This image reveals carved knots of gas and dust in a small portion of the Monkey Head Nebula. The nebula is a star-forming region that hosts dusky dust clouds silhouetted against glowing gas.,https://imagine.gsfc.nasa.gov/hst_bday/images/february-8-2019-monkey-head-nebula.jpg,https://hubblesite.org/contents/media/images/2014/18/3336-Image.html
FEBRUARY,9,2014,Monkey Head Nebula,This image reveals carved knots of gas and dust in a small portion of the Monkey Head Nebula. The nebula is a star-forming region that hosts dusky dust clouds silhouetted against glowing gas.,https://imagine.gsfc.nasa.gov/hst_bday/images/february-9-2019-monkey-head-nebula.jpg,https://hubblesite.org/contents/media/images/2014/18/3336-Image.html
FEBRUARY,10,2005,Brown Dwarf Candidate CHXR 73 B,"The bright spot at lower right is a suspected brown dwarf, an object bigger than a planet but smaller than a star. Named CHXR 73 B, it orbits a red dwarf star dubbed CHXR 73, which is much less massive than the Sun.",https://imagine.gsfc.nasa.gov/hst_bday/images/february-10-2019-brown-dwarf-candidate-chxr-73-b.jpg,https://hubblesite.org/contents/media/images/2006/31/1946-Image.html
FEBRUARY,11,2001,Thackeray's Globules,"These dense, dark dust clouds, named ""Thackeray's globules"" after astronomer A.D. Thackeray, are silhouetted against stars and bright gas clouds of the star-forming region IC 2944. The largest globule is actually two separate, overlapping clouds.",https://imagine.gsfc.nasa.gov/hst_bday/images/february-11-2019-thackeray-s-globules.jpg,https://hubblesite.org/contents/media/images/2002/01/1127-Image.html
FEBRUARY,12,2018,Lagoon Nebula,"This image zooms into the heart of a vast star-forming region called the Lagoon Nebula. A massive young star at the center of the image is blasting radiation and stellar winds, carving shapes into the surrounding gas and dust.",https://imagine.gsfc.nasa.gov/hst_bday/images/february-12-2019-lagoon-nebula.png,https://hubblesite.org/contents/media/images/2018/21/4150-Image.html
FEBRUARY,13,2011,Nebula Sharpless 2-106,"This star-forming region, called Sharpless 2-106, looks like a celestial angel. The ""wings"" of the nebula are twin lobes of hot gas that stretch outward from a massive, young star near the center of the image.",https://imagine.gsfc.nasa.gov/hst_bday/images/february-13-2019-nebula-sharpless-2-106.jpg,https://hubblesite.org/contents/media/images/2011/38/2932-Image.html
FEBRUARY,14,2007,Colliding Galaxies Arp 272,"Arp 272 is a collision between two spiral galaxies, linked by their swirling arms. The galaxies are members of the Hercules Galaxy cluster and are located roughly 450 million light-years from Earth.",https://imagine.gsfc.nasa.gov/hst_bday/images/february-14-2019-colliding-galaxies-arp-272.jpg,https://hubblesite.org/contents/media/images/2008/16/2334-Image.html
FEBRUARY,15,1998,Galaxy I Zwicky 18,"This image captures the irregular dwarf galaxy I Zwicky 18 and a companion galaxy to its upper right. The two galaxies are interacting, triggering star formation in I Zwicky 18.",https://imagine.gsfc.nasa.gov/hst_bday/images/february-15-2019-galaxy-i-zwicky-18.jpg,https://hubblesite.org/contents/media/images/2004/35/1621-Image.html
FEBRUARY,16,2005,Antennae Galaxies,"The two merging spiral galaxies that comprise the Antennae galaxies began their interaction only a few hundred million years ago. Over the course of the merger, billions of stars will be formed.",https://imagine.gsfc.nasa.gov/hst_bday/images/february-16-2019-antennae-galaxies.jpg,https://hubblesite.org/contents/media/images/2006/46/1995-Image.html
FEBRUARY,17,2015,Dwarf Galaxy Kiso 5639,"Hubble captured a firestorm of star birth lighting up one end of this dwarf galaxy. Called Kiso 5639, it is a member of a class of ""tadpole"" galaxies so named because of their bright heads and elongated tails.",https://imagine.gsfc.nasa.gov/hst_bday/images/february-17-2019-dwarf-galaxy-kiso-5639.jpg,https://hubblesite.org/contents/media/images/2016/23/3754-Image.html
FEBRUARY,18,2014,Herbig-Haro 24,"A partially obscured, newborn star near the center of this image is shooting twin jets into the surrounding gas and dust. The shocks from the collision light up patches of nebulosity collectively called Herbig-Haro 24.",https://imagine.gsfc.nasa.gov/hst_bday/images/february-18-2019-herbig-haro-24.jpg,https://hubblesite.org/contents/media/images/2015/42/3656-Image.html
FEBRUARY,19,2014,Monkey Head Nebula,This image reveals carved knots of gas and dust in a small portion of the Monkey Head Nebula. The nebula is a star-forming region that hosts dusky dust clouds silhouetted against glowing gas.,https://imagine.gsfc.nasa.gov/hst_bday/images/february-19-2019-monkey-head-nebula.jpg,https://hubblesite.org/contents/media/images/2014/18/3336-Image.html
FEBRUARY,20,2014,Monkey Head Nebula,This image reveals carved knots of gas and dust in a small portion of the Monkey Head Nebula. The nebula is a star-forming region that hosts dusky dust clouds silhouetted against glowing gas.,https://imagine.gsfc.nasa.gov/hst_bday/images/february-20-2019-monkey-head-nebula.jpg,https://hubblesite.org/contents/media/images/2014/18/3336-Image.html
FEBRUARY,21,2014,Monkey Head Nebula,This image reveals carved knots of gas and dust in a small portion of the Monkey Head Nebula. The nebula is a star-forming region that hosts dusky dust clouds silhouetted against glowing gas.,https://imagine.gsfc.nasa.gov/hst_bday/images/february-21-2019-monkey-head-nebula.jpg,https://hubblesite.org/contents/media/images/2014/18/3336-Image.html
FEBRUARY,22,2004,Spiral Galaxy NGC 1313,This image resolves stars in the center of the barred spiral galaxy NGC 1313. The galaxy is roughly 14 million light-years away in the constellation Reticulum.,https://imagine.gsfc.nasa.gov/hst_bday/images/february-22-2019-spiral-galaxy-ngc-1313.jpg,https://hubblesite.org/contents/media/images/2007/05/2044-Image.html
FEBRUARY,23,2013,Galaxies in the GOODS-North Field,"This image captures about 15,000 galaxies stretching back through 11 billion years of cosmic history. Hubble examined this part of the sky, located near the Big Dipper and called the GOODS-North field, as part of the Great Observatories Origins Deep Survey (GOODS).",https://imagine.gsfc.nasa.gov/hst_bday/images/february-23-2019-galaxies-in-the-goods-north-field.png,https://hubblesite.org/contents/media/images/2018/35/4219-Image.html
FEBRUARY,24,2009,Saturn and Moons,"In this image, four moons of Saturn are passing in front of the giant planet. The large, orange moon Titan casts a large shadow on the northern pole. Smaller moons Mimas, Dione and Enceladus appear as white dots.",https://imagine.gsfc.nasa.gov/hst_bday/images/february-24-2019-saturn-and-moons.jpg,https://hubblesite.org/contents/media/images/2009/12/2508-Image.html
FEBRUARY,25,1995,Mars,This image captures springtime in the northern hemisphere of Mars. The northern polar ice cap has receded to its core of solid water-ice several hundred miles across. Morning clouds appear along the planet's western (left) limb.,https://imagine.gsfc.nasa.gov/hst_bday/images/february-25-2019-mars.jpg,https://hubblesite.org/contents/media/images/1995/16/280-Image.html?news=true
FEBRUARY,26,2016,Bubble Nebula,"An enormous bubble is being blown into space by a super-hot, massive star. The Bubble Nebula is roughly seven light-years across and is located 7,100 light-years away in the constellation Cassiopeia.",https://imagine.gsfc.nasa.gov/hst_bday/images/february-26-2019-bubble-nebula.jpg,https://hubblesite.org/contents/media/images/2016/13/3725-Image.html
FEBRUARY,27,2002,Little Ghost Nebula,"The Little Ghost Nebula appears as a small, ghostly cloud surrounding a dying star. It is found in the constellation Ophiuchus between 2,000 and 5,000 light-years away.",https://imagine.gsfc.nasa.gov/hst_bday/images/february-27-2019-little-ghost-nebula.jpg,https://hubblesite.org/contents/media/images/2002/25/1251-Image.html
FEBRUARY,28,2008,Galactic Center,This infrared image of the center of our Milky Way galaxy reveals a population of massive stars and complex structures in the hot ionized gas that swirls around the galactic core.,https://imagine.gsfc.nasa.gov/hst_bday/images/february-28-2019-galactic-center.jpg,https://hubblesite.org/contents/media/images/2009/02/2453-Image.html
FEBRUARY,29,2004,SWEEPS Star Field,"Hubble peered into the crowded central bulge of our galaxy 26,000 light-years away and collected information for 180,000 stars as part of a survey called the Sagittarius Window Eclipsing Extrasolar Planet Search (SWEEPS).",https://imagine.gsfc.nasa.gov/hst_bday/images/february-29-2019-sweeps-star-field.jpg,https://hubblesite.org/contents/news-releases/2011/news-2011-16.html
MARCH,1,2011,Galaxy Cluster RCS2 032727-132623,"The light from a distant galaxy, nearly 10 billion light-years away, has been warped into arcs and streaks by the gravity of galaxy cluster RCS2 032727-132623. The cluster acts as a gravitational lens, bending and amplifying light from the background galaxy.",https://imagine.gsfc.nasa.gov/hst_bday/images/march-1-2019-galaxy-cluster-rcs2-032727-132623.jpg,https://hubblesite.org/contents/media/images/2012/08/2977-Image.html
MARCH,2,2006,Pluto System,"This image, taken through a red filter, captures Pluto and three of its satellites. The largest object in the image is Pluto and the second largest is Charon. Two smaller moons appear below them.",https://imagine.gsfc.nasa.gov/hst_bday/images/march-2-2019-pluto-system.jpg,https://hubblesite.org/contents/media/images/2006/15/1893-Image.html
MARCH,3,1994,Globular Cluster NGC 6397,This image captures about 200 stars in the globular cluster NGC 6397. The density of this star cluster is so low that Hubble can see right through the cluster and resolve far more-distant background galaxies behind it.,https://imagine.gsfc.nasa.gov/hst_bday/images/march-3-2019-globular-cluster-ngc-6397.jpg,https://hubblesite.org/contents/media/images/1994/41/198-Image.html
MARCH,4,2003,Galaxy Fornax A,"The dust lanes and star clusters of this giant elliptical galaxy, known as Fornax A, give evidence that the galaxy formed from a past merger of two gas-rich galaxies. It is also one of the strongest sources of radio emission in the sky.",https://imagine.gsfc.nasa.gov/hst_bday/images/march-4-2019-galaxy-fornax-a.jpg,https://hubblesite.org/contents/media/images/2005/11/1671-Image.html
