month,date,year,title,description,imageurl,moreinfourl
MAY,8,2013,Comet ISON,"At the time Hubble took this image, comet ISON (C/2012 S1) was hurtling toward the Sun at a whopping 48,000 miles per hour. The comet was 403 million miles from Earth, between the orbits of Mars and Jupiter.",https://imagine.gsfc.nasa.gov/hst_bday/images/may-8-2019-comet-ison.jpg,https://hubblesite.org/contents/media/images/2013/24/3197-Image.html
MAY,9,2008,Red Spots on Jupiter,"This image captures three red spots in Jupiter's atmosphere. The famous Great Red Spot appears on the right, while ""Red Spot Jr."" is to the lower left and an even smaller ""baby red spot"" appears at left.",https://imagine.gsfc.nasa.gov/hst_bday/images/may-9-2019-red-spots-on-jupiter.jpg,https://hubblesite.org/contents/media/images/2008/23/2354-Image.html?news=true
MAY,10,2008,Red Spots on Jupiter,"This image captures three red spots in Jupiter's atmosphere. The famous Great Red Spot appears on the right, while ""Red Spot Jr."" is to the lower left and an even smaller ""baby red spot"" appears at left.",https://imagine.gsfc.nasa.gov/hst_bday/images/may-10-2019-red-spots-on-jupiter.jpg,https://hubblesite.org/contents/media/images/2008/23/2354-Image.html
MAY,11,2002,Cone Nebula,"This image shows the tip of the Cone Nebula, a star-forming region in the constellation Monoceros. This conical pillar stretches over seven light-years and is just a small portion of a much larger star-formation complex.",https://imagine.gsfc.nasa.gov/hst_bday/images/may-11-2019-cone-nebula.jpg,https://hubblesite.org/contents/media/images/2002/13/1200-Image.html
MAY,12,1999,Star-Forming Region N11B,"This panoramic view captures an iridescent tapestry of star birth, filled with glowing gas, dark dust clouds, and young, hot stars. The star-forming region, cataloged as N11B, lies in a nearby galaxy, the Large Magellanic Cloud.",https://imagine.gsfc.nasa.gov/hst_bday/images/may-12-2019-star-forming-region-n11b.jpg,https://hubblesite.org/contents/media/images/2004/22/1565-Image.html
MAY,13,2002,Interacting Galaxies IRAS 19297-0406,"This image shows a tumultuous collision between four galaxies located 1 billion light-years from Earth. The tangled-up galaxies, called IRAS 19297-0406, are crammed together in the center of the picture.",https://imagine.gsfc.nasa.gov/hst_bday/images/may-13-2019-interacting-galaxies-iras-19297-0406.jpg,https://hubblesite.org/contents/media/images/2002/13/1199-Image.html
MAY,14,2013,Galaxy Cluster Abell 2744,"Located 3.5 billion light-years away, Abell 2744 contains several hundred galaxies and might be a pile-up of at least four smaller galaxy clusters. Abell 2744s strong gravitational field acts as a lens, brightening and magnifying the light of nearly 3,000 distant background galaxies.",https://imagine.gsfc.nasa.gov/hst_bday/images/may-14-2019-galaxy-cluster-abell-2744.jpg,https://hubblesite.org/image/3868/category/52-frontier-fields
MAY,15,2008,Red Spots on Jupiter,"This image captures three red spots in Jupiter's atmosphere. The famous Great Red Spot appears on the right, while ""Red Spot Jr."" is to the lower left and an even smaller ""baby red spot"" appears at left.",https://imagine.gsfc.nasa.gov/hst_bday/images/may-15-2019-red-spots-on-jupiter.jpg,https://hubblesite.org/contents/media/images/2008/27/2373-Image.html
MAY,16,2006,Hickson Compact Group 90,"These three galaxies, called NGC 7173 (middle left), NGC 7174 (middle right) and NGC 7176 (lower right), are part of Hickson Compact Group 90, named after astronomer Paul Hickson, who cataloged small groups of galaxies like this one.",https://imagine.gsfc.nasa.gov/hst_bday/images/may-16-2019-hickson-compact-group-90.jpg,https://hubblesite.org/contents/media/images/2009/10/2496-Image.html
MAY,17,2002,Galaxy Cluster RDCS 1252.9-2927,"This image captures a massive cluster of galaxies called RDCS 1252.9-2927. This galaxy cluster existed when the universe was only 5 billion years old, or about 35 percent of its present age.",https://imagine.gsfc.nasa.gov/hst_bday/images/may-17-2019-galaxy-cluster-rdcs-1252-9-2927.jpg,https://hubblesite.org/contents/media/images/2004/01/1436-Image.html
MAY,18,1994,Jupiter,"Hubble took this image of Jupiter when the giant planet was 420 million miles from Earth. The dark spot that appears on Jupiter is the shadow of the moon Io, which appears to the upper right of the shadow.",https://imagine.gsfc.nasa.gov/hst_bday/images/may-18-2019-jupiter.jpg,https://hubblesite.org/contents/media/images/1994/26/169-Image.html
MAY,19,2014,Jupiter's Auroras,Hubble used its ultraviolet vision to observe auroras around Jupiter's north pole. Auroras are formed when charged particles in the space around the planet are accelerated along the planet's magnetic field lines and interact with gases in the atmosphere.,https://imagine.gsfc.nasa.gov/hst_bday/images/may-19-2019-jupiter-s-auroras.jpg,https://hubblesite.org/contents/media/images/2016/24/3756-Image.html
MAY,20,2013,Galaxy Cluster Abell 2744,"Located 3.5 billion light-years away, Abell 2744 contains several hundred galaxies and might be a pile-up of at least four smaller galaxy clusters. Abell 2744s strong gravitational field acts as a lens, brightening and magnifying the light of nearly 3,000 distant background galaxies.",https://imagine.gsfc.nasa.gov/hst_bday/images/may-20-2019-galaxy-cluster-abell-2744.jpg,https://hubblesite.org/image/3868/category/52-frontier-fields
MAY,21,2000,Nebula NGC 1748,"Extremely intense radiation from newly born, ultra-bright stars has blown a glowing, spherical bubble in the nebula NGC 1748. The average-looking star at the very center of the bubble is about 30 times more massive and almost 200,000 times brighter than our Sun.",https://imagine.gsfc.nasa.gov/hst_bday/images/may-21-2019-nebula-ngc-1748.jpg,https://hubblesite.org/contents/media/images/2001/11/1039-Image.html
MAY,22,1995,Saturn,This image shows Saturn as the planet's magnificent ring system appeared edge-on to Earth. This alignment occurs about every 15 years when Earth passes through the plane of Saturn's rings. The bright dots to the left of Saturn are some of the planet's moons.,https://imagine.gsfc.nasa.gov/hst_bday/images/may-22-2019-saturn.jpg,https://hubblesite.org/contents/news-releases/1995/news-1995-25.html
MAY,23,2013,Galaxy Cluster Abell 2744,"Located 3.5 billion light-years away, Abell 2744 contains several hundred galaxies and might be a pile-up of at least four smaller galaxy clusters. Abell 2744s strong gravitational field acts as a lens, brightening and magnifying the light of nearly 3,000 distant background galaxies.",https://imagine.gsfc.nasa.gov/hst_bday/images/may-23-2019-galaxy-cluster-abell-2744.jpg,https://hubblesite.org/image/3868/category/52-frontier-fields
MAY,24,2013,Galaxy Cluster Abell 2744,"Located 3.5 billion light-years away, Abell 2744 contains several hundred galaxies and might be a pile-up of at least four smaller galaxy clusters. Abell 2744s strong gravitational field acts as a lens, brightening and magnifying the light of nearly 3,000 distant background galaxies.",https://imagine.gsfc.nasa.gov/hst_bday/images/may-24-2019-galaxy-cluster-abell-2744.jpg,https://hubblesite.org/image/3868/category/52-frontier-fields
MAY,25,2001,Galaxy NGC 4622,"This image shows the spiral galaxy NGC 4622. Its outer pair of winding arms is full of new stars, clumped together in blue clusters. Strangely, the galaxy appears to be rotating clockwise, the opposite direction to what astronomers expected.",https://imagine.gsfc.nasa.gov/hst_bday/images/may-25-2019-galaxy-ngc-4622.jpg,https://hubblesite.org/contents/media/images/2002/03/1137-Image.html
MAY,26,2003,Galaxy I Zwicky 18,"This image captures the irregular dwarf galaxy I Zwicky 18 and a companion galaxy to its upper right. The two galaxies are interacting, triggering star formation in I Zwicky 18.",https://imagine.gsfc.nasa.gov/hst_bday/images/may-26-2019-galaxy-i-zwicky-18.jpg,https://hubblesite.org/contents/media/images/2004/35/1621-Image.html
MAY,27,1998,Galaxy I Zwicky 18,"This image captures the irregular dwarf galaxy I Zwicky 18 and a companion galaxy to its upper right. The two galaxies are interacting, triggering star formation in I Zwicky 18.",https://imagine.gsfc.nasa.gov/hst_bday/images/may-27-2019-galaxy-i-zwicky-18.jpg,https://hubblesite.org/contents/media/images/2004/35/1621-Image.html
MAY,28,1998,Galaxy I Zwicky 18,"This image captures the irregular dwarf galaxy I Zwicky 18 and a companion galaxy to its upper right. The two galaxies are interacting, triggering star formation in I Zwicky 18.",https://imagine.gsfc.nasa.gov/hst_bday/images/may-28-2019-galaxy-i-zwicky-18.jpg,https://hubblesite.org/contents/media/images/2004/35/1621-Image.html
MAY,29,2003,Galaxy I Zwicky 18,"This image captures the irregular dwarf galaxy I Zwicky 18 and a companion galaxy to its upper right. The two galaxies are interacting, triggering star formation in I Zwicky 18.",https://imagine.gsfc.nasa.gov/hst_bday/images/may-29-2019-galaxy-i-zwicky-18.jpg,https://hubblesite.org/contents/media/images/2004/35/1621-Image.html
MAY,30,1999,Swan Nebula,"This image captures a small region within the Swan Nebula, a hotbed of star formation. The wave-like patterns of gas have been sculpted and illuminated by a torrent of ultraviolet radiation from young, massive stars, which lie outside the picture to the upper left.",https://imagine.gsfc.nasa.gov/hst_bday/images/may-30-2019-swan-nebula.jpg,https://hubblesite.org/contents/media/images/2003/13/1331-Image.html
MAY,31,2002,Galaxy NGC 2768,"NGC 2768 is an elliptical galaxy located 65 million light-years away in the constellation Ursa Major. The galaxy hosts a supermassive black hole, fueling jets of material in its active center.",https://imagine.gsfc.nasa.gov/hst_bday/images/may-31-2019-galaxy-ngc-2768.jpg,https://hubblesite.org/contents/media/images/2015/28/3615-Image.html
JUNE,1,2003,Galaxy I Zwicky 18,"This image captures the irregular dwarf galaxy I Zwicky 18 and a companion galaxy to its upper right. The two galaxies are interacting, triggering star formation in I Zwicky 18.",https://imagine.gsfc.nasa.gov/hst_bday/images/june-1-2019-galaxy-i-zwicky-18.jpg,https://hubblesite.org/contents/media/images/2004/35/1621-Image.html
JUNE,2,2014,Jupiter's Auroras,Hubble used its ultraviolet vision to observe auroras around Jupiter's north pole. Auroras are formed when charged particles in the space around the planet are accelerated along the planet's magnetic field lines and interact with gases in the atmosphere.,https://imagine.gsfc.nasa.gov/hst_bday/images/june-2-2019-jupiter-s-auroras.jpg,https://hubblesite.org/contents/media/images/2016/24/3756-Image.html
JUNE,3,2003,Galaxy I Zwicky 18,"This image captures the irregular dwarf galaxy I Zwicky 18 and a companion galaxy to its upper right. The two galaxies are interacting, triggering star formation in I Zwicky 18.",https://imagine.gsfc.nasa.gov/hst_bday/images/june-3-2019-galaxy-i-zwicky-18.jpg,https://hubblesite.org/contents/media/images/2004/35/1621-Image.html
JUNE,4,1994,Quasar 3C 273,"The quasar 3C 273 resides at the heart of a galaxy nearly 2 billion light-years away. A quasar is a brilliant source of energy at the center of a distant galaxy, and is believed to flare up when gas, dust or other material falls onto a supermassive black hole at the galaxys core.",https://imagine.gsfc.nasa.gov/hst_bday/images/june-4-2019-quasar-3c-273.jpg,https://hubblesite.org/contents/media/images/2003/03/1289-Image.html
JUNE,5,2007,Jupiter,"Jupiter's turbulent clouds are always changing as they encounter atmospheric disturbances while sweeping around the planet at hundreds of miles per hour. This image includes a dark, serpent-shaped structure that is actually a small tear in the cloud deck.",https://imagine.gsfc.nasa.gov/hst_bday/images/june-5-2019-jupiter.jpg,https://hubblesite.org/contents/media/images/2007/25/2152-Image.html
JUNE,6,2003,Galaxy I Zwicky 18,"This image captures the irregular dwarf galaxy I Zwicky 18 and a companion galaxy to its upper right. The two galaxies are interacting, triggering star formation in I Zwicky 18.",https://imagine.gsfc.nasa.gov/hst_bday/images/june-6-2019-galaxy-i-zwicky-18.jpg,https://hubblesite.org/contents/media/images/2004/35/1621-Image.html
JUNE,7,2010,Jupiter,"Hubble took this image of Jupiter four days after a giant meteor burned up in the planet's cloud tops. Hubble found no sign of dark debris at the site, meaning the meteor did not plunge deep enough into the atmosphere to explode and leave behind any telltale marks.",https://imagine.gsfc.nasa.gov/hst_bday/images/june-7-2019-jupiter.jpg,https://hubblesite.org/contents/media/images/2010/20/2742-Image.html
JUNE,8,2003,Sombrero Galaxy,"The Sombrero galaxy's hallmark is a brilliant white core encircled by thick lanes of dust. As seen from Earth, the spiral galaxy is tilted nearly edge-on.",https://imagine.gsfc.nasa.gov/hst_bday/images/june-8-2019-sombrero-galaxy.jpg,https://hubblesite.org/contents/media/images/2003/28/1415-Image.html
JUNE,9,2001,Galaxy NGC 6782,"This spiral galaxy, NGC 6782, exhibits tightly wound spiral arms and a spectacular, nearly circular bright ring surrounding its nucleus. The ring contains many recently formed hot stars.",https://imagine.gsfc.nasa.gov/hst_bday/images/june-9-2019-galaxy-ngc-6782.jpg,https://hubblesite.org/contents/media/images/2001/37/1122-Image.html
JUNE,10,2006,Galaxy NGC 7674,NGC 7674 is a spiral galaxy tilted nearly face-on to Earth. Faint streamers below and to the left of the galaxy have been created by gravitational interactions with companion galaxies.,https://imagine.gsfc.nasa.gov/hst_bday/images/june-10-2019-galaxy-ngc-7674.jpg,https://hubblesite.org/contents/media/images/2008/16/2297-Image.html
JUNE,11,1997,Star Cluster Omega Centauri,"This view shows about 50,000 stars at the heart of Omega Centauri, a huge globular star cluster 17,000 light-years from Earth. Omega Centauri is the biggest and brightest globular cluster in the Milky Way, and one of the few that can be seen by the unaided eye.",https://imagine.gsfc.nasa.gov/hst_bday/images/june-11-2019-star-cluster-omega-centauri.jpg,https://hubblesite.org/contents/media/images/2001/33/1117-Image.html
JUNE,12,2002,Galaxy Cluster Abell 1689,"This image shows the inner region of Abell 1689, an immense cluster of galaxies located 2.2 billion light-years away. Astronomers used Hubble to map the distrubition of dark matter in the galaxy cluster.",https://imagine.gsfc.nasa.gov/hst_bday/images/june-12-2019-galaxy-cluster-abell-1689.jpg,https://hubblesite.org/contents/media/images/2010/26/2758-Image.html
JUNE,13,2005,Star VY Canis Majoris,"The hypergiant star VY Canis Majoris is surrounded by clouds of gas that it has cast off in a long series of outbursts. These eruptions have formed loops, arcs and knots of material moving at various speeds and in many different directions.",https://imagine.gsfc.nasa.gov/hst_bday/images/june-13-2019-star-vy-canis-majoris.jpg,https://hubblesite.org/contents/media/images/2007/03/2039-Image.html
JUNE,14,2002,Galaxy Cluster Abell 1689,"This image shows the inner region of Abell 1689, an immense cluster of galaxies located 2.2 billion light-years away. Astronomers used Hubble to map the distrubition of dark matter in the galaxy cluster.",https://imagine.gsfc.nasa.gov/hst_bday/images/june-14-2019-galaxy-cluster-abell-1689.jpg,https://hubblesite.org/contents/media/images/2010/26/2758-Image.html
JUNE,15,1999,Globular Cluster M22,"M22 is one of about 150 globular star clusters in the Milky Way. Located just 10,000 light-years away in the constellation Sagettarius, it is one of the closest globular clusters to Earth.",https://imagine.gsfc.nasa.gov/hst_bday/images/june-15-2019-globular-cluster-m22.jpg,https://hubblesite.org/contents/media/images/2001/20/1075-Image.html
JUNE,16,2002,Galaxy Cluster Abell 1689,"This image shows the inner region of Abell 1689, an immense cluster of galaxies located 2.2 billion light-years away. Astronomers used Hubble to map the distrubition of dark matter in the galaxy cluster.",https://imagine.gsfc.nasa.gov/hst_bday/images/june-16-2019-galaxy-cluster-abell-1689.jpg,https://hubblesite.org/contents/media/images/2010/26/2758-Image.html
JUNE,17,1999,Stephan's Quintet,"This close-up shows four of the five galaxies that make up Stephans Quintet. The image reveals bright, blue clusters of stars, born from the violent interactions between some of the member galaxies.",https://imagine.gsfc.nasa.gov/hst_bday/images/june-17-2019-stephan-s-quintet.jpg,https://hubblesite.org/contents/media/images/2001/22/1082-Image.html?itemsPerPage=100&page=8&filterUUID=8a87f02e-e18b-4126-8133-2576f4fdc5e2&news=true
JUNE,18,1996,Hubble-V Nebula,"Hubble-V is an active star-forming region within galaxy NGC 6822. The cloud is about 200 light-years across and contains a dense knot of dozens of ultra-hot stars, each 100,000 times brighter than our Sun.",https://imagine.gsfc.nasa.gov/hst_bday/images/june-18-2019-hubble-v-nebula.jpg,https://hubblesite.org/contents/media/images/2001/39/1126-Image.html
JUNE,19,2019,Interacting Galaxies AM 2026-424,"The colliding galaxies AM 2026-424 resemble a face. Each ""eye"" is the bright core of a galaxy, one of which slammed into another. The outline of the face is a ring of young blue stars. Other clumps of new stars form a nose and mouth.",https://imagine.gsfc.nasa.gov/hst_bday/images/june-19-2019-interacting-galaxies-am-2026-424.png,https://hubblesite.org/contents/media/images/2019/51/4574-Image
JUNE,20,2002,Galaxy Cluster Abell 1689,"This image shows the inner region of Abell 1689, an immense cluster of galaxies located 2.2 billion light-years away. Astronomers used Hubble to map the distrubition of dark matter in the galaxy cluster.",https://imagine.gsfc.nasa.gov/hst_bday/images/june-20-2019-galaxy-cluster-abell-1689.jpg,https://hubblesite.org/contents/media/images/2010/26/2758-Image.html
JUNE,21,2002,Galaxy Cluster Abell 1689,"This image shows the inner region of Abell 1689, an immense cluster of galaxies located 2.2 billion light-years away. Astronomers used Hubble to map the distrubition of dark matter in the galaxy cluster.",https://imagine.gsfc.nasa.gov/hst_bday/images/june-21-2019-galaxy-cluster-abell-1689.jpg,https://hubblesite.org/contents/media/images/2010/26/2758-Image.html
JUNE,22,2012,Interacting Galaxies Arp 142,"The interacting galaxy duo near the bottom of this image is Arp 142. The pair contains the disturbed, star-forming spiral galaxy NGC 2936 along with its elliptical companion NGC 2937 at lower left. Above them is an unrelated, bluish galaxy called UGC 5130.",https://imagine.gsfc.nasa.gov/hst_bday/images/june-22-2019-interacting-galaxies-arp-142.jpg,https://hubblesite.org/contents/media/images/2013/23/3195-Image.html
JUNE,23,2004,Galaxies in the Groth Strip,"This field of galaxies is just a small part of a cosmic tapestry Hubble imaged as part of the All-wavelength Extended Groth Strip International Survey. In it are galaxies of all shapes, sizes, colors, and distances. Larger ones are nearby, while the smallest ones are far away.",https://imagine.gsfc.nasa.gov/hst_bday/images/june-23-2019-galaxies-in-the-groth-strip.jpg,https://hubblesite.org/contents/media/images/2007/06/2046-Image.html
JUNE,24,2002,Supernova 2002dd,"This image captures a stellar explosion called a supernova in a small part of the sky known as the Hubble Deep Field. The supernova, designated SN 2002dd, appears as a red dot near the center of the image.",https://imagine.gsfc.nasa.gov/hst_bday/images/june-24-2019-supernova-2002dd.jpg,https://hubblesite.org/contents/media/images/2003/12/1327-Image.html
JUNE,25,2011,Neptune,Neptune is the most distant major planet in our solar system. This image reveals high-altitude clouds in the northern and southern hemispheres of the planet. These clouds are composed of methane ice crystals.,https://imagine.gsfc.nasa.gov/hst_bday/images/june-25-2019-neptune.jpg,https://hubblesite.org/contents/media/images/2011/19/2860-Image.html
JUNE,26,2000,Seyfert's Sextet,"At first, Seyfert's Sextet looks like six galaxies grouped closely together. However, the small galaxy with the prominent spiral arms (right of center) is much farther away than the others, and a bright clump to the lower right is material torn from one of the other galaxies.",https://imagine.gsfc.nasa.gov/hst_bday/images/june-26-2019-seyfert-s-sextet.jpg,https://hubblesite.org/contents/media/images/2002/22/1242-Image.html
JUNE,27,2002,Galaxy Cluster RDCS 1252.9-2927,"This image captures the massive galaxy clutser RDCS 1252.9-2927. The galaxies in the cluster already existed when the universe was just 5 billion years old, or about 35 percent of its present age.",https://imagine.gsfc.nasa.gov/hst_bday/images/june-27-2019-galaxy-cluster-rdcs-1252-9-2927.jpg,https://hubblesite.org/contents/media/images/2004/01/1433-Image.html
JUNE,28,2005,Quasar MC2 1635+119,This image shows shells of stars around a quasar known as MC2 1635+119. Quasars are among the brightest objects in the universe. They reside in the centers of galaxies and are powered by supermassive black holes.,https://imagine.gsfc.nasa.gov/hst_bday/images/june-28-2019-quasar-mc2-1635-119.jpg,https://hubblesite.org/contents/news-releases/2007/news-2007-39.html
JUNE,29,2012,Pluto System,"This image captures Pluto and its five moons. Pluto is the large dot at the center. Its largest moon, Charon, appears below Pluto. Moving clockwise from the left, the smaller moons are Hydra, Styx, Nyx and Kerberos.",https://imagine.gsfc.nasa.gov/hst_bday/images/june-29-2019-pluto-system.jpg,https://hubblesite.org/contents/media/images/2012/32/3083-Image.html
JUNE,30,1998,Ant Nebula,The Ant Nebula displays intriguing symmetrical patterns in the lobes of gas being ejected from a dying Sun-like star at its center.,https://imagine.gsfc.nasa.gov/hst_bday/images/june-30-2019-ant-nebula.jpg,https://hubblesite.org/contents/media/images/2001/05/1020-Image.html
JULY,1,1993,Comet Shoemaker-Levy 9 Fragments,"This image captures the brightest ""nucleus"" in a string of approximately 20 that comprised the broken-up comet Shoemaker-Levy 9. The image reveals that the bright segment is actually a group of at least four separate pieces.",https://imagine.gsfc.nasa.gov/hst_bday/images/july-1-2019-comet-shoemaker-levy-9-fragments.jpg,https://hubblesite.org/contents/media/images/1993/22/117-Image.html
JULY,2,2011,Necklace Nebula,"The Necklace Nebula contains the glowing remains of an ordinary, Sun-like star shedding material at the end of its life. The nebula consists of a bright ring, measuring 12 trillion miles across, dotted with dense, bright knots of gas that resemble diamonds in a necklace.",https://imagine.gsfc.nasa.gov/hst_bday/images/july-2-2019-necklace-nebula.jpg,https://hubblesite.org/contents/media/images/2011/24/2886-Image.html
JULY,3,1999,Star Cluster 47 Tucanae,"This image shows the core of the globular star cluster 47 Tucanae. The entire cluster contains about a million stars, with many packed tightly in the core.",https://imagine.gsfc.nasa.gov/hst_bday/images/july-3-2019-star-cluster-47-tucanae.jpg,https://hubblesite.org/contents/media/images/2006/33/1951-Image.html
JULY,4,2002,Carina Nebula,"This close-up view shows only a three-light-year-wide portion of the entire Carina Nebula, which has a diameter of over 200 light-years. Located 8,000 light-years from Earth, the nebula can be seen in the southern sky with the naked eye.",https://imagine.gsfc.nasa.gov/hst_bday/images/july-4-2019-carina-nebula.jpg,https://hubblesite.org/contents/media/images/2003/31/1424-Image.html
JULY,5,2001,Trifid Nebula,"The Trifid Nebula is a stellar nursery criss-crossed by huge, dark lanes of dust. This image provides a close-up view of the center of the nebula, near the intersection of the dust bands, and a group of recently formed, massive, bright stars.",https://imagine.gsfc.nasa.gov/hst_bday/images/july-5-2019-trifid-nebula.jpg,https://hubblesite.org/contents/media/images/2004/17/1542-Image.html
JULY,6,2012,Planetary Nebula NGC 5189,"The knotty, filamentary structure of NGC 5189 formed as a dying star shed its outer layers. Interestingly, this planetary nebula has two nested structures tilted with respect to each other.",https://imagine.gsfc.nasa.gov/hst_bday/images/july-6-2019-planetary-nebula-ngc-5189.jpg,https://hubblesite.org/contents/media/images/2012/49/3124-Image.html
JULY,7,2010,Galaxy Cluster Abell 1689,"This image shows the center of Abell 1689, an immense cluster of galaxies located 2.2 billion light-years away. Astronomers used Hubble to map the distrubition of dark matter in the galaxy cluster.",https://imagine.gsfc.nasa.gov/hst_bday/images/july-7-2019-galaxy-cluster-abell-1689.jpg,https://hubblesite.org/contents/media/images/2013/36/3238-Image.html
JULY,8,2008,Jupiter's Spots,"This image provides a close look at Jupiter's famous Great Red Spot and a smaller storm dubbed ""Red Spot Jr."" below it. To the right of the Great Red Spot is the remnant of an even smaller spot that has faded and is being consumed by the much larger storm.",https://imagine.gsfc.nasa.gov/hst_bday/images/july-8-2019-jupiter-s-spots.jpg,https://hubblesite.org/contents/media/images/2008/27/2370-Image.html
JULY,9,2001,Hoag's Object,"A nearly perfect ring of hot, blue stars pinwheels about the yellow nucleus of an unusual galaxy known as Hoag's Object. Curiously, a background object that bears an uncanny resemblance to Hoag's Object can be seen in the gap at the one o'clock position.",https://imagine.gsfc.nasa.gov/hst_bday/images/july-9-2019-hoag-s-object.jpg,https://hubblesite.org/contents/media/images/2002/21/1241-Image.html
